Property Name,Property Cost,Property Type,Property Area,Property Locality
Platinum Greens,₹ 36.33 - 48.91 L,2 BHKApartment,(88.82 - 119.57 sq.m.),Shree Adinath HospitalRedfox SchoolSanganer Railway StationSparsh HospitalRIICO Industrial Area
Mahimas Shubh Nilay,₹ 29.9 L,2 BHKApartment,(77.39 sq.m.),St Xavier's SchoolAllahabad BankHanuman Mandir
Uttam Casa 10,₹ 1.3 - 1.45 Cr,3 BHKVilla,(222.97 - 248.98 sq.m.),Teoler High SchoolMaharana Pratap RdElements MallMansarover Metro StationNH52
Siddha Happyville,₹ 50 L,3 BHKVilla,(159.79 sq.m.),Gopalpur F.P SchoolCentral Bank of India ATMAxis Bank ATMICICI BankRakesh.M.s
Urbana Jewels,₹ 38 L,2 BHKApartment,(138.12 sq.m.),Kautilya Law College LLBState Bank of India ATMBank of MaharashtraGovernment Industrial Training InstituteShopping Centre
Mahima Sansaar,₹ 32.81 - 40.24 L,2 BHKApartment,(74.35 - 91.17 sq.m.),Sarla Bihari TempleChokhi DhaniHotel Crown PlazaBombay HospitalWorld Trade Park
Consol Raghunandan Heights,₹ 39.51 - 48.51 L,3 BHKApartment,(101.71 - 123.42 sq.m.),Bhaskar Public SchoolCK Birla HospitalsWorld Trade ParkIIS JaipurKanakpura Railway Station
Mudgal Sneh Villa,₹ 76 L,3 BHKVilla,(181.16 sq.m.),N/A
Ashiana Umang,₹ 48.06 L,2 BHKApartment,(74.23 sq.m.),"JK Lakshmipat UniversityMahindra World City, SEZJayshree Periwal International SchoolArya InstituteNH 48, Ramchandpura, Rajasthan"
Ganesham Utsav,₹ 59.57 - 69.46 L,3 BHKApartment,(108.51 - 126.53 sq.m.),N/A
Lifestyle Podium,₹ 4.8 Cr,3 BHKApartment,(198.16 sq.m.),Gopathi Narayanaswami Chetty RoadChalla MallBe Well Hospitals T. NagarMambalam Railway Station Exit IIAG-DMS Metro
ALTA,₹ 33.29 - 33.42 L,2 BHKApartment,(93.74 - 94.11 sq.m.),MahabalipuramKelambakkam JunctionSiruseri IT ParkSSN engineering collegeChettinad Health City Hospital
Intermont One,₹ 2.25 Cr,3 BHKApartment,(130.44 sq.m.),N/A
Pace Anusa,₹ 54.04 L,2 BHKApartment,(109.25 sq.m.),Tambaram Railway stationTambaram Bus StopChennai international airportLords international campusAnnai arul hospital
Navins Hanging Gardens,₹ 1.1 - 1.22 Cr,2 BHKApartment,(92.16 - 107.95 sq.m.),State Highway 113ANN HospitalMeenakshi Academy of Higher EducationFeathers A Radha HotelNexus Vijaya Mall
TVS Emerald Luxor,₹ 2.65 - 3.2 Cr,3 BHKApartment,(109.63 - 125.6 sq.m.),VR ChennaiBe Well Hospitals Anna NagarGrand Northern Trunk RoadThirumangalam Metro StationExcel Global School
Casagrand First City,₹ 33.91 L,1 BHKApartment,(60.02 sq.m.),NPS InternationalGleneagles Global Health CityELCOT IT ParkRajiv Gandhi SalaiNovotel Chennai OMR
Casagrand Cloud9,₹ 90 L,2 BHKApartment,(128.67 sq.m.),Campus K International SchoolSholinganallur Main RoadSwaram Hospital Rajiv Gandhi SalaiECR Beach
Casagrand Flagship,₹ 57 L,2 BHKApartment,(101.08 sq.m.),NPS International SchoolDr.Kamakshi Memorial HospitalsRajiv Gandhi Salai ExpresswayNovotel Chennai OMRFutura Tech Park
Casagrand Southbrooke,Price on Request,1 BHKApartment,(47.66 - 48.31 sq.m.),OMRAarupadai Veedu Matric SchoolKelambakkam junctionHindustan Institute of TechnologyChettinad Super Speciality Hospital
Casagrand Primrose,Price on Request,1 BHKApartment,(63.73 sq.m.),Mother Teresa SchoolAnnai Arul HospitalB. S. Abdur RahmanUrapakkam Railway StationChennai International Airport
Casagrand Elinor,₹ 50 L,2 BHKApartment,(103.03 sq.m.),Karanai Main RoadBVM Global - CBSE SchoolRajiv Gandhi SalaiVivira MallSipcot IT Park
One Land,₹ 46.79 - 98.98 L,Land,(96.62 - 204.39 sq.m.),N/A
PS srijan Nexterra Phase 2,₹ 51.46 - 53.88 L,2 BHKApartment,(78.97 - 82.68 sq.m.),Sai Sankalp Primary SchoolRMT International SchoolJS Global SchoolSathyabama UniversityJeppiaar Engineering College
Casagrand Aria,Price on Request,1 BHKApartment,(48.87 - 49.15 sq.m.),Vandalur Railway StationChennai International AirportAnnai Arul HospitalNarayana E techno SchoolPeri College
CasaGrand Elysium,Price on Request,1 BHKApartment,(61.22 - 78.22 sq.m.),National Highway 32Lalaji Memorial Omega SchoolCrossway Parklane Airport Hotel ChennaiPallavaram Railway StationChennai International Airport
Casagrand Divinity,₹ 1.69 Cr,4 BHKVilla,(235.79 sq.m.),BVM Global - CBSE SchoolFour Points by Sheraton Chennai OMRRajiv Gandhi Salai ExpresswaySathyabama Institute of Science & ITVivira Mall
Casagrand Platinum,₹ 1.07 - 1.21 Cr,3 BHKVilla,(153.94 - 173.73 sq.m.),Tambaram - Mudichur - Walajabad RoadAlwin International Public SchoolPERI College of PharmacyKalyan Grand - a business hotelAnnai Arul Hospital
Navins Hillview Avenue,₹ 41 - 71 L,2 BHKApartment,(56.39 - 109.07 sq.m.),BP Jain HospitalPeace On Green Earth Public SchoolPallavaram FlyoverChrompet Railway StationChennai International Airport
Casagrand Majestica,₹ 82 L - 1.14 Cr,2 BHKApartment,(140.28 - 165.09 sq.m.),SH 55Feathers A Radha HotelDLF Cybercity ChennaiSRM UniversityAlandur Metro Station
Urbanrise Revolution One,₹ 34 L,1 BHKApartment,(48.77 sq.m.),Hindustan Institute of Tech. & ScienceGateway International School (CBSE)Novotel Chennai SipcotThe Marina MallSIPCOT IT Park
Sri Balajis Saphire,₹ 79.45 L - 1.05 Cr,2 BHKApartment,(76.37 - 103.49 sq.m.),Poonamallee High RoadDr. M.G.R. Edu. And Research UniversityRakshith HospitalKoyambedu Metro StationNexus Vijaya Mall
Appaswamy Parkhouse Mews,₹ 2.83 - 3.05 Cr,3 BHKApartment,(175.22 - 188.96 sq.m.),The Westin Chennai VelacheryPhoenix MarketcityMount RoadMadras Gymkhana Golf AnnexeDr. M.G.R. Medical University
Appaswamy Wingfield,₹ 2.02 - 2.22 Cr,,"(Completion in Dec, 2025)",Rajiv Gandhi Salai ExpresswayApollo Multi Speciality HospitalKottivakkam BeachTaramani Railway StationHoliday Inn Chennai
Appaswamy The Broadstone,₹ 1.86 - 2.21 Cr,,"(Completion in Dec, 2025)",Mount Poonamallee RoadDLF Cybercity ChennaiFeathers A Radha HotelMiot HospitalAnand Singapore International School
Sarang by Sumadhura Phase 1,Price on Request,2 BHKApartment,(113.81 sq.m.),Whitefield - Hoskote RoadGreat International SchoolAaxis HospitalsOrion Uptown MallWhitefield (Kadugodi) Metro Station
SM Art,₹ 88.65 - 94.88 L,2 BHKApartment,(109.81 - 117.52 sq.m.),Central MallState Highway 35Belandur Road Railway StationLions Airport City HospitalGJR International School
Folium By Sumadhura Phase 2,₹ 2.15 - 3.37 Cr,3 BHKApartment,(139.82 - 218.79 sq.m.),Kadugodi Tree Park Metro StationManipal Hospital Varthur RoadNexus WhitefieldWhitefield Railway StationGopalan Pre University College
M1 Terra Alegria,₹ 1.79 - 2.16 Cr,4 BHKVilla,(246.19 - 297.75 sq.m.),NH648Sun Valley Public SchoolHoskote Mission HospitalMahadeva Pre University CollegeKR Puram Railway Station
Lodha Mirabelle,₹ 1.49 Cr,2 BHKApartment,(125.42 sq.m.),N/A
Coconut Grove,₹ 41.05 L - 1.08 Cr,Land,(111.48 - 294.97 sq.m.),CS Junior CollegeNew Blossom High SchoolBanashankari HospitalDMartBannerghatta Main Road
Sattva Misty Charm,₹ 35.82 - 53.16 L,1 BHKApartment,(51.19 - 56.3 sq.m.),Holiday Village ResortKSITVajarahalli Metro StationSelenite Sports AcademyDelhi Public School
Sobha Dream Gardens,₹ 60.01 - 68 L,1 BHKApartment,(38.28 - 42.83 sq.m.),Euro SchoolReva InstituteBellahalliKannuruDelhi Public School
Prestige Park Grove,₹ 60.55 - 61.61 L,1 BHKApartment,(38.28 - 39.39 sq.m.),State Highway 35Manipal HospitalKadugodi Railway StationWhitefield (Kadugodi) Metro stationOrion UPTOWN Mall
Sanjeevini Srushti,₹ 52 - 57.56 L,2 BHKApartment,(86.86 - 96.15 sq.m.),Devangonthi Railway StationShwethajali Bharathanaya schoolNH 648SHPL IT ParkSanctum Suites
Assetz Soho and Sky,₹ 1.79 - 2.75 Cr,3 BHKApartment,(122.14 - 187.2 sq.m.),PKS SchoolSH 104Esteem MallManipal Hospital HebbalHebbal railway station
JRC Wild Woods,₹ 1.3 Cr,2 BHKApartment,(140.27 sq.m.),Primus public schoolDmartKarmelram Railway stationDecathlon SarjapurRGA Tech park
Monarch Aqua,₹ 98.61 L - 1.14 Cr,2 BHKApartment,(103.12 - 119.94 sq.m.),Fantasy ParkAmara Jyothi Public SchoolAltor HospitalsJanakiNarayana ComplexFeatherlite Evoma Hotel
Sobha Brooklyn Towers,Price on Request,1 BHKApartment,(26.66 - 27.13 sq.m.),National Highway 48Medhini ArcadeAthreya HospitalJnana Jyoti Public SchoolBommasandra Metro Station
Godrej Ananda,₹ 46 L - 1.38 Cr,2 BHKApartment,(49.24 - 90.39 sq.m.),BK Halli Road (SH 104)St. Francis SchoolFiestaa Resort D Cube Sports ClubN R V Hospital
Goyal Orchid Platinum,₹ 1.86 - 2.33 Cr,3 BHKApartment,(94.46 - 118.48 sq.m.),Gopalan National SchoolHope HospitalGarden City UniversityBrookefield MallBangalore Cant Junction
Prestige Serenity Shores,₹ 1.17 - 1.67 Cr,2 BHKApartment,(61.23 - 87.3 sq.m.),Chrysalis High VarthurKrupanidhi Degree CollegeSahasra HospitalsBrookefield MallBelandur Road railway station
Casagrand Zaiden,₹ 75 - 79 L,2 BHKApartment,(114.27 - 118.08 sq.m.),Kanakpura RoadNICE Ring RoadSilk Institute Metro StationJnana Sweekar Public SchoolRitu Hospital
Sumadhura Sushantham Phase 2,₹ 94.33 L - 1.19 Cr,2 BHKApartment,(113.81 - 144.0 sq.m.),Manyata Tech ParkKirloskar Business ParkEsteem MallRMZ Galleria MallColumbia Asia Hospital
Avani Abode,₹ 2.11 - 4.21 Cr,4 BHKVilla,(230.21 - 459.41 sq.m.),East Point HospitalOrion Uptown MallGarden City UniversityBNR Memorial SchoolITPL Metro Station
Sobha Town Park Manhattan Towers,₹ 74.02 - 75.61 L,2 BHKApartment,(47.47 - 48.5 sq.m.),N/A
Siddartha Solitaire,₹ 65 - 68.79 L,2 BHKApartment,(103.59 - 109.63 sq.m.),Hosa Road Metro StationPES UniversityFab Hypermart SingasandraMedwell Multi-specialty HospitalThe Paradise PU College
Concorde Hill Crest,₹ 35 - 58.87 L,Land,(111.48 - 187.48 sq.m.),NH 44GHS RG Halli High SchoolAmbareshwar Degree College
Nava Gokulam,₹ 71.84 - 83.98 L,2 BHKApartment,(74.69 - 87.05 sq.m.),NH 44Elements MallHilton Garden InnAltius Multispeciality HospitalsDeva Matha Central School
Abhignas Misty Woods,₹ 2.14 - 2.4 Cr,3 BHKApartment,(192.59 - 216.65 sq.m.),"JP Nagar Metro StationFrank Public SchoolEurokids, JP NagarAster RV HospitalVega City Mall"
